{
  "$schema": "http://json-schema.org/draft-07/schema#",
  "title": "AIVendorReview",
  "description": "Schema for conducting risk reviews on AI tools and external vendors.",
  "type": "object",
  "properties": {
    "vendor": {
      "type": "string",
      "description": "The name of the vendor providing the AI tool or service."
    },
    "tool": {
      "type": "string",
      "description": "The name of the specific tool, model, or API."
    },
    "useCase": {
      "type": "string",
      "description": "The specific internal or external business use case."
    },
    "businessOwner": {
      "type": "string",
      "description": "The internal team lead or department head sponsoring the tool."
    },
    "dataEntered": {
      "type": "array",
      "items": {
        "type": "string"
      },
      "description": "Categories of data submitted to the tool (e.g. source code, customer support transcripts, employee notes)."
    },
    "outputUse": {
      "type": "string",
      "description": "Where and how the outputs generated by the AI tool will be used."
    },
    "retentionPosition": {
      "type": "string",
      "description": "The vendor's data retention duration policy (e.g. zero data retention, 30 days)."
    },
    "trainingOnCustomerData": {
      "type": "boolean",
      "description": "Whether the vendor uses submitted data/inputs to train their public or base models."
    },
    "subprocessors": {
      "type": "array",
      "items": {
        "type": "string"
      },
      "description": "Any underlying sub-processors or hosting partners used by this AI tool."
    },
    "securityMaterial": {
      "type": "array",
      "items": {
        "type": "string"
      },
      "description": "Security documents reviewed (e.g. SOC 2 Type II, ISO 27001, Pen Test Reports)."
    },
    "approvedUse": {
      "type": "boolean",
      "description": "Whether the tool is officially approved for internal or production use."
    },
    "prohibitedUse": {
      "type": "array",
      "items": {
        "type": "string"
      },
      "description": "Explicitly banned use cases or data types (e.g. do not enter PII or source code)."
    },
    "conditions": {
      "type": "array",
      "items": {
        "type": "string"
      },
      "description": "Conditions under which the tool may be used (e.g. opt-out of model training, SSO configuration)."
    }
  },
  "required": [
    "vendor",
    "tool",
    "useCase",
    "businessOwner",
    "dataEntered",
    "retentionPosition",
    "trainingOnCustomerData",
    "approvedUse"
  ]
}
